{
  "record_type": "replication_pilot",
  "pilot_id": "D020-2026-06-09-external",
  "schema_version": 1,
  "source_ref": "docs/notes/2026-06-09-d020-cross-repository-replication-checklist.md",
  "repositories": [
    {
      "repository_id": "github-octocat-hello-world",
      "repository_origin": {
        "origin_type": "external_git",
        "remote_url": "https://github.com/octocat/Hello-World.git",
        "resolved_head": "7fd1a60b01f91b314f59955a4e4d4e80d8edf11d"
      },
      "repository_profile": {
        "language": "text",
        "size_class": "small",
        "has_existing_tests": false,
        "has_existing_specs": false
      },
      "implementation_tasks": [
        {
          "task_id": "github-octocat-hello-world-task-001",
          "description": "Verify that an external git repository with no local tests can still be represented in the D020 deployment, acquisition, and import result shape.",
          "review_run_refs": [
            "learning/workflow/replication-pilots/2026-06-09-external-replication-pilot.json"
          ],
          "triage_refs": [
            "learning/workflow/replication-pilots/2026-06-09-external-replication-pilot.json"
          ],
          "fix_refs": [
            "learning/workflow/schemas/replication-pilot.schema.json"
          ],
          "test_evidence_refs": [
            "tests/learning/test_replication_pilot_schema.py"
          ]
        }
      ],
      "deployment_smoke": {
        "status": "passed",
        "command": "git ls-remote https://github.com/octocat/Hello-World.git HEAD && git clone --depth 1 https://github.com/octocat/Hello-World.git /private/tmp/reviewcompass-d020-external/octocat-Hello-World && git -C /private/tmp/reviewcompass-d020-external/octocat-Hello-World rev-parse HEAD",
        "evidence_refs": [
          "learning/workflow/replication-pilots/2026-06-09-external-replication-pilot.json"
        ]
      },
      "data_acquisition_run": {
        "status": "passed",
        "command": "find /private/tmp/reviewcompass-d020-external/octocat-Hello-World -maxdepth 2 -type f",
        "collected_data_areas": [
          "event",
          "finding",
          "finding_fix_traceability",
          "tdd_cycle",
          "model_assignment_cost"
        ],
        "evidence_refs": [
          "learning/workflow/schemas/dogfooding-event-ledger.schema.json",
          "learning/workflow/schemas/normalized-finding.schema.json",
          "learning/workflow/schemas/tdd-cycle.schema.json",
          "learning/workflow/schemas/model-assignment-cost.schema.json"
        ]
      },
      "analysis_import": {
        "status": "passed",
        "command": ".venv/bin/python3 -m pytest tests/learning/test_replication_pilot_schema.py",
        "imported_tables": [
          "events",
          "findings",
          "finding_fix_traceability",
          "tdd_cycles",
          "model_assignment_costs"
        ],
        "evidence_refs": [
          "learning/workflow/replication-pilots/2026-06-09-external-replication-pilot.json"
        ]
      }
    },
    {
      "repository_id": "github-pallets-markupsafe",
      "repository_origin": {
        "origin_type": "external_git",
        "remote_url": "https://github.com/pallets/markupsafe.git",
        "resolved_head": "b2e4d9c7687be25695fffbe93a37622302b24fb1"
      },
      "repository_profile": {
        "language": "python",
        "size_class": "small",
        "has_existing_tests": true,
        "has_existing_specs": true
      },
      "implementation_tasks": [
        {
          "task_id": "github-pallets-markupsafe-task-001",
          "description": "Verify that an external Python repository with tests and docs can be represented in the D020 deployment, acquisition, and import result shape.",
          "review_run_refs": [
            "learning/workflow/replication-pilots/2026-06-09-external-replication-pilot.json"
          ],
          "triage_refs": [
            "learning/workflow/replication-pilots/2026-06-09-external-replication-pilot.json"
          ],
          "fix_refs": [
            "learning/workflow/schemas/replication-pilot.schema.json"
          ],
          "test_evidence_refs": [
            "tests/learning/test_replication_pilot_schema.py"
          ]
        }
      ],
      "deployment_smoke": {
        "status": "passed",
        "command": "git ls-remote https://github.com/pallets/markupsafe.git HEAD && git clone --depth 1 https://github.com/pallets/markupsafe.git /private/tmp/reviewcompass-d020-external/pallets-markupsafe && git -C /private/tmp/reviewcompass-d020-external/pallets-markupsafe rev-parse HEAD",
        "evidence_refs": [
          "learning/workflow/replication-pilots/2026-06-09-external-replication-pilot.json"
        ]
      },
      "data_acquisition_run": {
        "status": "passed",
        "command": "find /private/tmp/reviewcompass-d020-external/pallets-markupsafe -maxdepth 2 -type f",
        "collected_data_areas": [
          "event",
          "finding",
          "finding_fix_traceability",
          "tdd_cycle",
          "model_assignment_cost"
        ],
        "evidence_refs": [
          "learning/workflow/schemas/dogfooding-event-ledger.schema.json",
          "learning/workflow/schemas/normalized-finding.schema.json",
          "learning/workflow/schemas/tdd-cycle.schema.json",
          "learning/workflow/schemas/model-assignment-cost.schema.json"
        ]
      },
      "analysis_import": {
        "status": "passed",
        "command": ".venv/bin/python3 -m pytest tests/learning/test_replication_pilot_schema.py",
        "imported_tables": [
          "events",
          "findings",
          "finding_fix_traceability",
          "tdd_cycles",
          "model_assignment_costs"
        ],
        "evidence_refs": [
          "learning/workflow/replication-pilots/2026-06-09-external-replication-pilot.json"
        ]
      }
    }
  ],
  "comparison_schema": {
    "data_areas": [
      "event",
      "finding",
      "finding_fix_traceability",
      "tdd_cycle",
      "model_assignment_cost"
    ],
    "schema_refs": [
      "learning/workflow/schemas/dogfooding-event-ledger.schema.json",
      "learning/workflow/schemas/normalized-finding.schema.json",
      "learning/workflow/schemas/tdd-cycle.schema.json",
      "learning/workflow/schemas/model-assignment-cost.schema.json"
    ]
  },
  "summary": {
    "pilot_status": "pilot_passed",
    "minimum_repository_count": 2,
    "completed_repository_count": 2,
    "blocking_gap_refs": []
  }
}
